{"id":"interaction.raid.scrap_container","scene_id":"scene.playable.raid.machine_silo","anchor_id":"anchor.scene.playable.raid.machine_silo.scrap_container","display_name":"Scrap Container","category":"container","prompt_text":"Open the Scrap Container","help_text":"Grab salvage and keep moving toward extraction.","panel_id":"ui.raid.scrap_container","objective_id":"objective.raid.collect_loot","priority":"5","range_meters":"2.6","facing_threshold":"0.25","prompt_cooldown_ms":"300","hold_to_interact":"false"}
