{"id":"interaction.raid.power_cell_cache","scene_id":"scene.playable.raid.machine_silo","anchor_id":"anchor.scene.playable.raid.machine_silo.power_cell_cache","display_name":"Power Cell Cache","category":"pickup","prompt_text":"Take the Power Cell Cache","help_text":"This is the optional high-value detour in the raid.","panel_id":"ui.raid.power_cell","objective_id":"objective.raid.optional_detour","priority":"4","range_meters":"2.4","facing_threshold":"0.25","prompt_cooldown_ms":"300","hold_to_interact":"false"}
