{"id":"interaction.home.companion_terminal","scene_id":"scene.playable.home_base","anchor_id":"anchor.scene.playable.home_base.companion_terminal","display_name":"Companion Terminal","category":"terminal","prompt_text":"Inspect the Companion Terminal","help_text":"Read the explain panel and change follow distance safely.","panel_id":"ui.station.companion","objective_id":"objective.home.change_companion_setting","priority":"4","range_meters":"2.5","facing_threshold":"0.25","prompt_cooldown_ms":"350","hold_to_interact":"false"}
