{"id":"interaction.home.mission_board","scene_id":"scene.playable.home_base","anchor_id":"anchor.scene.playable.home_base.mission_board","display_name":"Mission Board","category":"station","prompt_text":"Open the Mission Board","help_text":"Choose the next mission and launch into the raid.","panel_id":"ui.station.mission_board","objective_id":"objective.home.find_mission_board","priority":"5","range_meters":"2.6","facing_threshold":"0.25","prompt_cooldown_ms":"350","hold_to_interact":"false"}
