{"id":"interaction.raid.mission_console","scene_id":"scene.playable.raid.machine_silo","anchor_id":"anchor.scene.playable.raid.machine_silo.mission_console","display_name":"Mission Console","category":"mission_object","prompt_text":"Activate the Mission Console","help_text":"Use the console to confirm the current objective beat.","panel_id":"ui.raid.mission_console","objective_id":"objective.raid.activate_console","priority":"3","range_meters":"2.5","facing_threshold":"0.25","prompt_cooldown_ms":"300","hold_to_interact":"false"}
