{"id":"interaction.home.workbench","scene_id":"scene.playable.home_base","anchor_id":"anchor.scene.playable.home_base.workbench","display_name":"Workshop Bench","category":"station","prompt_text":"Use the Workbench","help_text":"Repair gear and manage simple workshop changes.","panel_id":"ui.station.workbench","objective_id":"objective.home.find_workbench","priority":"4","range_meters":"2.6","facing_threshold":"0.25","prompt_cooldown_ms":"350","hold_to_interact":"false"}
