{"id":"interaction.raid.extraction_pad","scene_id":"scene.playable.raid.machine_silo","anchor_id":"anchor.scene.playable.raid.machine_silo.extraction_pad","display_name":"Extraction Pad","category":"extraction","prompt_text":"Begin Extraction","help_text":"Stay inside the zone until the countdown finishes.","panel_id":"ui.raid.extraction","objective_id":"objective.raid.extract","priority":"6","range_meters":"3.0","facing_threshold":"0.20","prompt_cooldown_ms":"250","hold_to_interact":"true"}
