{"id":"interaction.results.return_home","scene_id":"scene.playable.results","anchor_id":"anchor.scene.playable.results.return_home","display_name":"Return Home","category":"terminal","prompt_text":"Return to Home Base","help_text":"Leave the results scene and head back to the home base.","panel_id":"ui.results.return_home","objective_id":"objective.results.return_home","priority":"5","range_meters":"2.5","facing_threshold":"0.25","prompt_cooldown_ms":"350","hold_to_interact":"false"}
