{"id":"interaction.home.results_nook","scene_id":"scene.playable.home_base","anchor_id":"anchor.scene.playable.home_base.results_nook","display_name":"Results Review Nook","category":"terminal","prompt_text":"Review the last results","help_text":"Reopen the last results summary and mentor notes.","panel_id":"ui.station.results","objective_id":"objective.home.review_results","priority":"2","range_meters":"2.5","facing_threshold":"0.25","prompt_cooldown_ms":"350","hold_to_interact":"false"}
