{"id":"interaction.home.stash","scene_id":"scene.playable.home_base","anchor_id":"anchor.scene.playable.home_base.stash","display_name":"Inventory Stash","category":"station","prompt_text":"Open the Inventory Stash","help_text":"Review gear and loot before launching the next mission.","panel_id":"ui.station.stash","objective_id":"objective.home.find_stash","priority":"3","range_meters":"2.5","facing_threshold":"0.25","prompt_cooldown_ms":"350","hold_to_interact":"false"}
